{
  "$schema": "https://json-schema.org/draft/2020-12/schema",
  "$id": "data/playthrough.schema.json",
  "description": "Data contract 1.5: Playthrough (section 1) / データ契約 1.5：Playthrough（第 1 節）",
  "$ref": "#/$defs/Playthrough",
  "$defs": {
    "Playthrough": {
      "title": "Playthrough",
      "description": "One playthrough of the game (section 1) / 1 回のプレイ（第 1 節）",
      "type": "object",
      "properties": {
        "schemaVersion": {
          "$ref": "common.schema.json#/$defs/SchemaVersion"
        },
        "playthroughId": {
          "$ref": "common.schema.json#/$defs/PlaythroughId"
        },
        "userRef": {
          "type": "string",
          "description": "Anonymous ID of the invite-code account (S-020), not an email address or a name / 招待コードアカウントの匿名 ID（S-020）。メールアドレスでも氏名でもない"
        },
        "worldModelVersion": {
          "type": "string",
          "description": "Locked at the start, unchanged for the whole playthrough / 開始時に固定し、プレイ中は変わらない"
        },
        "roleId": {
          "$ref": "common.schema.json#/$defs/RoleId",
          "description": "The role the player chose / プレイヤーが選んだ身分"
        },
        "playerAlias": {
          "type": "string",
          "description": "S-010: not filled by default; the first version has no UI for it / S-010：既定では埋めない。最初の版には入力する画面がない"
        },
        "ageBand": {
          "enum": ["under13", "13to17", "18plus", "unknown"],
          "description": "S-010: not collected by default / S-010：既定では収集しない"
        },
        "status": {
          "enum": ["active", "ended", "abandoned", "deleted"]
        },
        "startedAt": {
          "$ref": "common.schema.json#/$defs/RecordedAt"
        },
        "endedAt": {
          "$ref": "common.schema.json#/$defs/RecordedAt"
        },
        "lastActiveAt": {
          "$ref": "common.schema.json#/$defs/RecordedAt",
          "description": "Real time of the last player activity; the default retention period counts from it / プレイヤーが最後に操作した実時間。既定の保持期間はこれを起点に数える"
        },
        "lastSeq": {
          "type": "integer",
          "minimum": 0,
          "description": "Sequence number of the last event / 最後のイベントの通し番号"
        }
      },
      "required": [
        "schemaVersion",
        "playthroughId",
        "userRef",
        "worldModelVersion",
        "roleId",
        "status",
        "startedAt",
        "lastActiveAt",
        "lastSeq"
      ],
      "additionalProperties": false
    }
  }
}
